instance_id,scenario,subtype,migration_type,repo_full_name,pr_number,pr_url,title,body_summary,changed_file_summary,has_tests_before,adds_new_tests,auto_signals,manual_label,source_language,target_language,source_version,target_version,migration_pattern,test_framework,build_system,reproducible,issue_rewrite_ready,leakage_risk,exclude_reason,reviewer,cross_check_status,notes
cpp_python__arendst__Tasmota__pr24599,language_migration,cpp_python,cross_language_migration,arendst/Tasmota,24599,https://github.com/arendst/Tasmota/pull/24599,Berry solidification made possible with Python runtime,## Description: The Berry runtime was ported from `C` to `Python` which allows to move solidification stage into the toolchain. The goal is eventually to introduce new features like conditional compilation (smaller firmwares) and text localization. The porting took less than a week using Kiro and...,lib/libesp32/berry/berry_port/__init__.py; lib/libesp32/berry/berry_port/__main__.py; lib/libesp32/berry/berry_port/be_api.py; lib/libesp32/berry/berry_port/be_baselib.py; lib/libesp32/berry/berry_port/be_bytecode.py; lib/libesp32/berry/berry_port/be_byteslib.py; lib/libesp32/berry/berry_port/be_class.py; lib/libesp32/berry/berry_port/be_code.py; lib/libesp32/berry/berry_port/be_constobj.py; lib/libesp32/berry/berry_port/be_debug.py; lib/libesp32/berry/berry_port/be_decoder.py; lib/libesp32/berry/berry_port/be_exec.py; lib/libesp32/berry/berry_port/be_filelib.py; lib/libesp32/berry/berry_port/be_func.py; lib/libesp32/berry/berry_port/be_gc.py; lib/libesp32/berry/berry_port/be_int64lib.py; lib/libesp32/berry/berry_port/be_jsonlib.py; lib/libesp32/berry/berry_port/be_lexer.py; lib/libesp32/berry/berry_port/be_libs.py; lib/libesp32/berry/berry_port/be_list.py,true,false,strict_migration_signal; touches_code,,,,,,,,,unknown,needs_check,low,,,,
cpp_python__hdtv-tool__hdtv__pr52,language_migration,cpp_python,cross_language_migration,hdtv-tool/hdtv,52,https://github.com/hdtv-tool/hdtv/pull/52,Move TH1IntegrateWithPartialBins from C++ to Python,"ROOT.HDTV.TH1IntegrateWithPartialBins() is only used in histogram.py. Since it is a small and easy function, it can be implemented directly in PyROOT and does not need to be compiled. --- This patch isn't covered by the test suite. ~I'm also unsure how to trigger the function manually.~ Manual...",src/hdtv/histogram.py; src/hdtv/rootext/fit/LinkDef.h; src/hdtv/rootext/fit/Util.cc; src/hdtv/rootext/fit/Util.hh,true,false,keyword_match; strict_migration_signal; touches_code,,,,,,,,,unknown,needs_check,low,,,,
cpp_python__heikki-laitala__pruner__pr30,language_migration,cpp_python,cross_language_migration,heikki-laitala/pruner,30,https://github.com/heikki-laitala/pruner/pull/30,feat: add C/C++ language support,"## Summary - Add `tree-sitter-c` and `tree-sitter-cpp` grammars for parsing C and C++ source files - C extraction: functions, structs, enums, unions, typedefs, `#include` directives, and call expressions (including `->` member calls) - C++ extraction: classes, namespaces, structs, inline and out-...",Cargo.toml; README.md; src/indexer.rs; src/languages.rs; src/parser.rs; tests/fixtures/c_project/src/auth.c; tests/fixtures/c_project/src/auth.h; tests/fixtures/c_project/src/main.c; tests/fixtures/c_project/src/user.c; tests/fixtures/c_project/src/user.h; tests/fixtures/c_project/tests/test_auth.c; tests/fixtures/cpp_project/src/auth_service.cpp; tests/fixtures/cpp_project/src/auth_service.hpp; tests/fixtures/cpp_project/src/main.cpp; tests/fixtures/cpp_project/src/user.hpp; tests/fixtures/cpp_project/tests/auth_test.cpp; tests/integration.rs,true,true,adds_new_tests; touches_code; touches_tests,,,,,,,test_files_detected,,unknown,needs_check,low,,,,
cpp_python__openvdb__fvdb-core__pr595,language_migration,cpp_python,cross_language_migration,openvdb/fvdb-core,595,https://github.com/openvdb/fvdb-core/pull/595,Move Gaussian splatting autograd and pipeline logic from C++ to Python,"## Summary - Port all C++ autograd functions (projection, rasterization, SH evaluation) to pure Python `torch.autograd.Function` implementations in a new `_gaussian_autograd.py` module, making the differentiable pipeline easier to extend and debug. - Eliminate the C++ `GaussianSplat3d` class...",fvdb/__init__.py; fvdb/__init__.pyi; fvdb/_fvdb_cpp.pyi; fvdb/_gaussian_autograd.py; fvdb/gaussian_splatting.py; fvdb/viz/_gaussian_splat_3d_view.py; fvdb/viz/_scene.py; src/CMakeLists.txt; src/fvdb/GaussianSplat3d.cpp; src/fvdb/GaussianSplat3d.h; src/fvdb/detail/autograd/EvaluateSphericalHarmonics.cpp; src/fvdb/detail/autograd/EvaluateSphericalHarmonics.h; src/fvdb/detail/autograd/GaussianProjection.cpp; src/fvdb/detail/autograd/GaussianProjection.h; src/fvdb/detail/autograd/GaussianRasterize.cpp; src/fvdb/detail/autograd/GaussianRasterize.h; src/fvdb/detail/autograd/GaussianRasterizeFromWorld.cpp; src/fvdb/detail/autograd/GaussianRasterizeFromWorld.h; src/fvdb/detail/autograd/GaussianRasterizeSparse.cpp; src/fvdb/detail/autograd/GaussianRasterizeSparse.h,true,false,keyword_match; strict_migration_signal; touches_code; touches_tests,,,,,,,pytest,cmake,unknown,needs_check,low,,,,
cpp_python__pespila__max-min-hill-climbing-algorithm__pr2,language_migration,cpp_python,cross_language_migration,pespila/max-min-hill-climbing-algorithm,2,https://github.com/pespila/max-min-hill-climbing-algorithm/pull/2,Migrate MMHC from R/C++ to Python with Streamlit app and notebooks,"Replace the entire R package + Rcpp/C++ backend with a modern Python implementation using NumPy, SciPy, Numba, and NetworkX. Key improvements over the original: - No conditioning variable limit (was capped at 3) - Cycle detection during hill-climbing (was missing) - Reproducible via seeded RNG...",.Rbuildignore; .gitignore; .pre-commit-config.yaml; CLAUDE.md; DESCRIPTION; LICENSE; NAMESPACE; R/data.R; R/mmhc.R; README.md; app/streamlit_app.py; man/mmhc.Rd; man/report.pdf; mmhc.Rproj; mmhc_0.1.tar.gz; notebooks/01_quickstart.ipynb; notebooks/02_custom_data.ipynb; pyproject.toml; src/mmhc.cpp; src/mmhc.h,true,true,adds_new_tests; keyword_match; strict_migration_signal; touches_code; touches_tests,,,,,,,pytest,poetry,unknown,needs_check,high,,,,
cpp_python__taco-project__FlexKV__pr127,language_migration,cpp_python,cross_language_migration,taco-project/FlexKV,127,https://github.com/taco-project/FlexKV/pull/127,[bugfix] Rewrite transfer metrics from C++ to Python side,"Previously, transfer metrics (ops_total, bytes_total) were recorded in the C++ layer (transfer.cu, transfer_ssd.cpp, gds_manager.cpp) via MetricsManager macros. Although C++ has its own Prometheus exporter (port 8081), the actual data transfer code runs in forked worker subprocesses, which do not...",csrc/gds/gds_manager.cpp; csrc/monitoring/metrics_manager.cpp; csrc/monitoring/metrics_manager.h; csrc/transfer.cu; csrc/transfer_ssd.cpp; docs/monitoring/README_en.md; docs/monitoring/README_zh.md; flexkv/cache/cache_engine.py; flexkv/common/transfer.py; flexkv/kvtask.py; flexkv/metrics/__init__.py; flexkv/metrics/collector.py; flexkv/transfer/transfer_engine.py; monitoring/grafana/dashboards/flexkv-demo.json; third_party/prometheus-cpp,true,false,keyword_match; strict_migration_signal; touches_code,,,,,,,,,unknown,needs_check,low,,,,
